https://www.youtube.com/playlist?list=OZgM0XSvVQA,WHY YOU DON’T TOP TREES (explained),arboristBlairGlenn,11:31,https://www.youtube.com/playlist?list=OZgM0XSvVQA
https://www.youtube.com/playlist?list=EjY897CCu4g,The Oldest View - Beneath The Earth,Kane Pixels,12:08,https://www.youtube.com/playlist?list=EjY897CCu4g
https://www.youtube.com/playlist?list=7W8UFuHTh_4,"What Happens if Your Villagers Haven’t Seen You in 3 Years, 30 Years, or 300 Years",GameSam,8:39,https://www.youtube.com/playlist?list=7W8UFuHTh_4
https://www.youtube.com/playlist?list=3GGg4XOsaRI,Every Feature Mojang Removed From Minecraft (And Why),Skip the Tutorial,12:09,https://www.youtube.com/playlist?list=3GGg4XOsaRI
https://www.youtube.com/playlist?list=o6EG7TqJPIc,Waves hitting a Sierpinski carpet,Nils Berglund,6:08,https://www.youtube.com/playlist?list=o6EG7TqJPIc
https://www.youtube.com/playlist?list=_p7U23euXvM,The Monsters he Raised became Beautiful Monster-Girls and came back to him! - Manga Recap,Manga Fresh,1:20:10,https://www.youtube.com/playlist?list=_p7U23euXvM
https://www.youtube.com/playlist?list=lOnVL2NTkMw,There are gym wizards outside my tower,Frauded,0:19,https://www.youtube.com/playlist?list=lOnVL2NTkMw
https://www.youtube.com/playlist?list=IX5CCz9RG8w,NECRO-NANCY 64: Spooky House,Macabre_1031,20:12,https://www.youtube.com/playlist?list=IX5CCz9RG8w
